212,Monkey Gland,17189,,,,,,,"IBA,Classic",,Ordinary Drink,Unforgettables,Alcoholic,Cocktail glass,"Shake well over ice cubes in a shaker, strain into a chilled cocktail glass.",,"Im Shaker über Eiswürfel gießen, in ein gekühltes Cocktailglas abseihen.",,,,Gin,Benedictine,Orange juice,Grenadine,,,,,,,,,,,,2 oz ,1 tsp ,1/2 oz ,1 tsp ,,,,,,,,,,,,No,2017-09-02 12:11:31
213,Munich Mule,178315,,,,,,,,,Cocktail,,Alcoholic,Highball glass,"Fill glass with ice
Pour Gin and Lime Juice
Fill glass with Ginger Beer
Garnish with Cucumer and Lime slice",,,,,,Gin,Lime Juice,Ginger Beer,Cucumber,lemon,,,,,,,,,,,5 cl,2 cl,10 cl,Chopped,Chopped,,,,,,,,,,,Yes,
214,Negroni,11003,,,,,,,"IBA,Classic",,Ordinary Drink,Unforgettables,Alcoholic,Old-fashioned glass,"Stir into glass over ice, garnish and serve.",,"In ein Glas über das Eis gießen, garnieren und servieren.",,,,Gin,Campari,Sweet Vermouth,,,,,,,,,,,,,1 oz ,1 oz ,1 oz ,,,,,,,,,,,,,Yes,2015-08-18 15:12:07
215,Orange Oasis,11870,,,,,,,,,Ordinary Drink,,Alcoholic,Highball glass,"Shake brandy, gin, and orange juice with ice and strain into a highball glass over ice cubes. Fill with ginger ale, stir, and serve.",,"Brandy, Gin und Orangensaft mit Eis schütteln und in ein Highball-Glas über Eiswürfel abseihen. Mit Ginger Ale füllen, umrühren und servieren.",,,,Cherry brandy,Gin,Orange juice,Ginger ale,,,,,,,,,,,,1/2 oz ,1 1/2 oz ,4 oz ,,,,,,,,,,,,,Yes,2015-09-02 05:25:23
216,Paradise,17190,,,,,,,IBA,,Ordinary Drink,Unforgettables,Alcoholic,Cocktail glass,Shake together over ice. Strain into cocktail glass and serve chilled.,,Zusammen über Eis schütteln. In ein Cocktailglas abseihen und gekühlt servieren.,,,,Gin,Apricot Brandy,Orange Juice,,,,,,,,,,,,,7 parts,4 parts,3 parts ,,,,,,,,,,,,,No,2017-09-02 12:17:40
217,Pegu Club,17249,,,,,,,,,Cocktail,,Alcoholic,Cocktail glass,"Shake, strain, up, cocktail glass",,"Schütteln, abseihen, auffüllen, Cocktailglas.",,,,Gin,Orange Curacao,Lime Juice,Angostura Bitters,Orange Bitters,,,,,,,,,,,1 1/2 oz,3/4 oz,3/4 oz,1 dash,1 dash,,,,,,,,,,,No,2017-12-19 17:18:23
218,Pink Gin,11936,,,,,,,,,Ordinary Drink,,Alcoholic,White wine glass,"Pour the bitters into a wine glass. Swirl the glass to coat the inside with the bitters, shake out the excess. Pour the gin into the glass. Do not add ice.",,"Den Bitter in ein Weinglas gießen. Das Glas umrühren, um die Innenseite mit dem Bitter zu überziehen, den Überschuss ausschütten. Gießen Sie den Gin in das Glas. Füge kein Eis hinzu.",,,,Bitters,Gin,,,,,,,,,,,,,,3 dashes ,2 oz ,,,,,,,,,,,,,,No,2017-09-08 17:36:58
219,Pink Lady,11938,,,,,,,,,Ordinary Drink,,Alcoholic,Cocktail glass,"Shake all ingredients with ice, strain into a cocktail glass, and serve.",,"Alle Zutaten mit Eis schütteln, in ein Cocktailglas abseihen und servieren.",,,,Gin,Grenadine,Light cream,Egg white,,,,,,,,,,,,1 1/2 oz ,1 tsp ,1 tsp ,1 ,,,,,,,,,,,,No,2017-09-08 17:23:49
220,Poppy Cocktail,11959,,,,,,,,,Ordinary Drink,,Alcoholic,Cocktail glass,"Shake ingredients with ice, strain into a cocktail glass, and serve.",,"Die Zutaten mit Eis schütteln, in ein Cocktailglas abseihen und servieren.",,,,Gin,Creme de Cacao,,,,,,,,,,,,,,1 1/2 oz ,3/4 oz white ,,,,,,,,,,,,,,No,2017-09-02 23:05:15
221,Queen Elizabeth,11991,,,,,,,,,Ordinary Drink,,Alcoholic,Cocktail glass,"Stir all ingredients with ice, strain into a cocktail glass, and serve.",,"Alle Zutaten mit Eis verrühren, in ein Cocktailglas abseihen und servieren.",,,,Dry Vermouth,Gin,Benedictine,,,,,,,,,,,,,1/2 oz ,1 1/2 oz ,1 1/2 tsp ,,,,,,,,,,,,,No,2016-11-12 15:08:59
222,Rose,17208,,,,,,,"IBA,ContemporaryClassic",,Ordinary Drink,Contemporary Classics,Alcoholic,Cocktail glass,"Shake together in a cocktail shaker, then strain into chilled glass. Garnish and serve.",,In einem Cocktailshaker vermengen und dann in ein gekühltes Glas abseihen. Garnieren und servieren.,,,,Dry Vermouth,Gin,Apricot brandy,Lemon juice,Grenadine,Powdered sugar,,,,,,,,,,1/2 oz ,1 oz ,1/2 oz ,1/2 tsp ,1 tsp ,,,,,,,,,,,No,2017-09-02 17:57:42
223,Rosemary Blue,17245,,,,,,,,,Cocktail,,Alcoholic,Balloon Glass,"1) Add the Bombay Sapphire, Blue Curacao, rosemary sprig and gently squeezed lemon wedge to a balloon glass. Swirl well to combine.
2) Fill with cubed ice and top with the Fever-Tree Light Tonic Water.
3) Gently fold with a bar spoon to mix.",,"Fügen Sie den Bombay Saphir, Blauen Curacao, Rosmarinzweig und den sanft ausgedrückten Zitronenkeil in ein Ballonglas ein. Gut mischen. Mit Eiswürfel füllen und mit dem Fever-Tree Light Tonic Water auffüllen. Vorsichtig mit einem Barlöffel zum Mischen verrühren.",,,,Gin,Blue Curacao,Tonic Water,Rosemary,,,,,,,,,,,,50 ml,15 ml,100 ml,Garnish with,,,,,,,,,,,,No,2017-12-04 16:55:43
224,Royal Fizz,12055,,,,,,,,,Ordinary Drink,,Alcoholic,Collins glass,Shake all ingredients (except cola) with ice and strain into a chilled collins glass. Fill with cola and serve.,,Alle Zutaten (außer Cola) mit Eis schütteln und in ein gekühltes Collins-Glas abseihen. Mit Cola auffüllen und servieren.,,,,Gin,Sweet and sour,Egg,Coca-Cola,,,,,,,,,,,,1 oz ,2 oz ,1 whole ,,,,,,,,,,,,,No,2017-09-02 23:16:49
225,Royal Gin Fizz,12057,,,,,,,,,Ordinary Drink,,Alcoholic,Highball glass,"Shake all ingredients (except carbonated water) with ice and strain into a highball glass over two ice cubes. Fill with carbonated water, stir, and serve.",,"Alle Zutaten (außer kohlensäurehaltigem Wasser) mit Eis schütteln und über zwei Eiswürfel in ein Highball-Glas sieben. Mit kohlensäurehaltigem Wasser auffüllen, umrühren und servieren.",,,,Gin,Lemon,Powdered sugar,Egg,Carbonated water,,,,,,,,,,,2 oz ,Juice of 1/2 ,1 tsp ,1 whole ,,,,,,,,,,,,No,2017-09-06 23:07:52
226,Ruby Tuesday,17114,,,,,,,,,Cocktail,,Alcoholic,Highball glass,Pour gin and cranberry into a highball filled with ice cubes. Add grenadine and stir.,,Gießen Sie Gin und Cranberry in einen mit Eiswürfeln gefüllten Highball. Grenadine zugeben und umrühren.,,,,Gin,Cranberry juice,Grenadine,,,,,,,,,,,,,2 oz ,5 oz ,2 splashes ,,,,,,,,,,,,,No,2015-09-06 16:30:37
227,Salted Toffee Martini,17233,,,,,,,,,Cocktail,,Alcoholic,Cocktail glass,"Add ice, toffee gin, chocolate liqueur and Amaretto to a cocktail shaker and shake vigorously. 
Pour the chocolate syrup into a saucer and dip the top of a martini glass into the sauce. Grate some of the Willie\'s sea salt chocolate into another saucer and dip the coated glass, so the flakes stick to the sauce, creating a chocolate rim!
Pour the contents of the shaker into your chocolatey glass and sprinkle with more grated chocolate - enjoy!  ",,"Eis, Toffee Gin, Schokoladenlikör und Amaretto in einen Cocktailshaker geben und kräftig schütteln.",,,,Gin,Chocolate liqueur,Amaretto,Chocolate Sauce,Salted Chocolate,,,,,,,,,,,50 ml ,30 ml ,15 ml,Garnish,Grated,,,,,,,,,,,No,2017-11-01 15:46:51
228,Salty Dog,12107,,,,,,,,,Ordinary Drink,,Alcoholic,Highball glass,"Pour all ingredients over ice cubes in a highball glass. Stir well and serve. (Vodka may be substituted for gin, if preferred.)",,"Alle Zutaten über Eiswürfel in ein Highball-Glas gießen. Gut umrühren und servieren. (Wodka kann durch Gin ersetzt werden, wenn gewünscht.)",,,,Grapefruit juice,Gin,Salt,,,,,,,,,,,,,5 oz ,1 1/2 oz ,1/4 tsp ,,,,,,,,,,,,,No,2017-09-08 18:03:36
229,Singapore Sling,12214,,,,,,,"IBA,ContemporaryClassic",,Ordinary Drink,Contemporary Classics,Alcoholic,Hurricane glass,Pour all ingredients into cocktail shaker filled with ice cubes. Shake well. Strain into highball glass. Garnish with pineapple and cocktail cherry.,,Alle Zutaten in einen mit Eiswürfeln gefüllten Cocktailshaker geben. Gut schütteln. In ein Highball-Glas abseihen. Mit Ananas und Cocktailkirsche garnieren.,,,,Cherry brandy,Grenadine,Gin,Sweet and sour,Carbonated water,Cherry,,,,,,,,,,1/2 oz ,1/2 oz ,1 oz ,2 oz ,,,,,,,,,,,,Yes,2015-08-18 14:58:08
230,Surf City Lifesaver,12760,,,,,,,,,Ordinary Drink,,Alcoholic,Highball glass,Lots of ice and soda top up in tall glass with cherry and a grin.,,Viel Eis und Soda in einem hohen Glas mit Cherry und Gin auffüllen.,,,,Ouzo,Baileys irish cream,Gin,Grand Marnier,,,,,,,,,,,,1 part ,1 part ,2 parts ,1/2 part ,,,,,,,,,,,,No,2017-02-20 14:58:19
231,The Laverstoke,17824,,,,,,,,,Cocktail,,Alcoholic,Balloon Glass,"1) Squeeze two lime wedges into a balloon glass then add the cordial, Bombay Sapphire and MARTINI Rosso Vermouth, swirl to mix.

2) Fully fill the glass with cubed ice and stir to chill.

3) Top with Fever-Tree Ginger Ale and gently stir again to combine.

4) Garnish with a snapped ginger slice and an awoken mint sprig.",,"Zwei Limettenkeile in ein Ballonglas drücken und dann die Herznote, Bombay Sapphire und MARTINI Rosso Wermut hinzufügen, verrühren. Füllen Sie das Glas vollständig mit Eiswürfeln und rühren Sie es um, um es abzukühlen. Mit dem Fever-Tree Ginger Ale auffüllen und zum Mischen wieder leicht umrühren. Mit einer geöffneten Ingwerscheibe und einem Minzzweig garnieren.",,,,Gin,Elderflower cordial,Rosso Vermouth,Tonic Water,Lime,Ginger,Mint,,,,,,,,,50 ml,15 ml,15 ml,75 ml,2 Wedges,1 Slice,1 Large Sprig,,,,,,,,,No,2018-02-04 12:46:52
232,Tom Collins,12402,,,,,,,,,Ordinary Drink,,Alcoholic,Collins glass,"In a shaker half-filled with ice cubes, combine the gin, lemon juice, and sugar. Shake well. Strain into a collins glass alomst filled with ice cubes. Add the club soda. Stir and garnish with the cherry and the orange slice.",,"In einem Shaker, der halb mit Eiswürfeln gefüllt ist, Gin, Zitronensaft und Zucker mischen. Gut schütteln. In ein Collins-Glas abseihen, das mit Eiswürfeln gefüllt ist. Füge das Club-Soda hinzu. Umrühren und mit der Kirsche und der Orangenscheibe garnieren.",,,,Gin,Lemon juice,Sugar,Club soda,Maraschino cherry,Orange,,,,,,,,,,2 oz ,1 oz ,1 tsp superfine ,3 oz ,1 ,1 ,,,,,,,,,,No,2015-08-18 15:21:22
233,Turf Cocktail,12418,,,,,,,,,Ordinary Drink,,Alcoholic,Cocktail glass,Stir all ingredients (except orange peel) with ice and strain into a cocktail glass. Add the twist of orange peel and serve.,,Alle Zutaten (außer Orangenschale) mit Eis verrühren und in ein Cocktailglas abseihen. Orangenspirale hinzufügen und servieren.,,,,Dry Vermouth,Gin,Anis,Bitters,Orange peel,,,,,,,,,,,1 oz ,1 oz ,1/4 tsp ,2 dashes ,Twist of ,,,,,,,,,,,No,2015-09-06 16:46:07
234,Tuxedo Cocktail,12420,,,,,,,"IBA,Classic",,Ordinary Drink,Unforgettables,Alcoholic,Cocktail glass,Stir all ingredients with ice and strain into a cocktail glass. Garnish with a cherry and a twist of lemon zest.,,Alle Zutaten mit Eis verrühren und in ein Cocktailglas abseihen. Mit einer Kirsche und einem Schuss Zitrone garnieren.,,,,Dry Vermouth,Gin,Maraschino liqueur,Anis,Orange bitters,Cherry,,,,,,,,,,1 1/2 oz ,1 1/2 oz ,1/4 tsp ,1/4 tsp ,2 dashes ,1 ,,,,,,,,,,No,2017-09-02 12:42:31
235,Victor,12450,,,,,,,,,Ordinary Drink,,Alcoholic,Cocktail glass,"Shake all ingredients with ice, strain into a cocktail glass, and serve.",,"Alle Zutaten mit Eis schütteln, in ein Cocktailglas abseihen und servieren.",,,,Gin,Sweet Vermouth,Brandy,,,,,,,,,,,,,1 1/2 oz ,1/2 oz ,1/2 oz ,,,,,,,,,,,,,No,2017-04-23 20:40:16
236,Victor,12450,,,,,,,,,Ordinary Drink,,Alcoholic,Cocktail glass,"Shake all ingredients with ice, strain into a cocktail glass, and serve.",,"Alle Zutaten mit Eis schütteln, in ein Cocktailglas abseihen und servieren.",,,,Gin,Sweet Vermouth,Brandy,,,,,,,,,,,,,1 1/2 oz ,1/2 oz ,1/2 oz ,,,,,,,,,,,,,No,2017-04-23 20:40:16
237,Victor,12450,,,,,,,,,Ordinary Drink,,Alcoholic,Cocktail glass,"Shake all ingredients with ice, strain into a cocktail glass, and serve.",,"Alle Zutaten mit Eis schütteln, in ein Cocktailglas abseihen und servieren.",,,,Gin,Sweet Vermouth,Brandy,,,,,,,,,,,,,1 1/2 oz ,1/2 oz ,1/2 oz ,,,,,,,,,,,,,No,2017-04-23 20:40:16
238,Victor,12450,,,,,,,,,Ordinary Drink,,Alcoholic,Cocktail glass,"Shake all ingredients with ice, strain into a cocktail glass, and serve.",,"Alle Zutaten mit Eis schütteln, in ein Cocktailglas abseihen und servieren.",,,,Gin,Sweet Vermouth,Brandy,,,,,,,,,,,,,1 1/2 oz ,1/2 oz ,1/2 oz ,,,,,,,,,,,,,No,2017-04-23 20:40:16
239,Waikiki Beachcomber,12474,,,,,,,,,Ordinary Drink,,Alcoholic,Cocktail glass,"Shake all ingredients with ice, strain into a cocktail glass, and serve.",,"Alle Zutaten mit Eis schütteln, in ein Cocktailglas abseihen und servieren.",,,,Triple sec,Gin,Pineapple juice,,,,,,,,,,,,,3/4 oz ,3/4 oz ,1 tblsp ,,,,,,,,,,,,,No,2015-09-02 16:43:03
240,White Lady,17194,,,,,,,"IBA,Classic",,Ordinary Drink,Unforgettables,Alcoholic,Cocktail glass,Add all ingredients into cocktail shaker filled with ice. Shake well and strain into large cocktail glass.,,Alle Zutaten in den mit Eis gefüllten Cocktailshaker geben. Gut schütteln und in ein großes Cocktailglas abseihen.,,,,Gin,Triple Sec,Lemon Juice,,,,,,,,,,,,,4cl,3cl,2cl,,,,,,,,,,,,,No,2017-09-02 12:49:52
241,110 in the shade,15423,,,,,,,,,Beer,,Alcoholic,Beer Glass,Drop shooter in glass. Fill with beer,,Shooter tröpfchenweise in ein Glas geben. Mit Bier füllen.,,,,Lager,Tequila,,,,,,,,,,,,,,16 oz ,1.5 oz ,,,,,,,,,,,,,,No,2016-02-03 14:51:57
242,Amaretto Stone Sour #3,16100,,,,,,,,,Other/Unknown,,Alcoholic,Highball glass,"Shake sour mix, tequila and amaretto with ice. Strain into highball glass. Add a splash of OJ. Garnish with orange slice and a cherry.",,"Sauergemisch, Tequila und Amaretto mit Eis schütteln. In ein Highball-Glas abseihen. Füge einen Spritzer OJ hinzu. Mit einer Orangenscheibe und einer Kirsche garnieren.",,,,Sour mix,Amaretto,Tequila,Orange juice,,,,,,,,,,,,2 oz ,2 oz ,2 oz ,Add splash ,,,,,,,,,,,,No,2016-09-01 09:53:32
243,Apple Grande,16289,,,,,,,,,Punch / Party Drink,,Alcoholic,Punch Bowl,Chill both ingredients!! Mix in a tumbler and enjoy!,,Kühlen Sie beide Zutaten herunter. In einem Becher mischen und genießen!,,,,Tequila,Apple cider,,,,,,,,,,,,,,3 oz ,12 oz ,,,,,,,,,,,,,,No,2016-08-31 19:37:02
244,Bloody Maria,11112,,,,,,,"Breakfast,Brunch,Hangover",,Ordinary Drink,,Alcoholic,Old-fashioned glass,Shake all ingredients (except lemon slice) with cracked ice and strain into an old-fashioned glass over ice cubes. Add the slice of lemon and serve.,,Alle Zutaten (außer Zitronenscheibe) mit zerkleinertem Eis schütteln und über Eiswürfel in ein old-fashioned Glas seihen. Die Zitronenscheibe dazugeben und servieren.,,,,Tequila,Tomato juice,Lemon juice,Tabasco sauce,Celery salt,Lemon,,,,,,,,,,1 oz ,2 oz ,1 dash ,1 dash ,1 dash ,1 slice ,,,,,,,,,,No,2017-09-02 22:57:41
245,Blue Margarita,11118,,,,,,,,,Ordinary Drink,,Alcoholic,Cocktail glass,"Rub rim of cocktail glass with lime juice. Dip rim in coarse salt. Shake tequila, blue curacao, and lime juice with ice, strain into the salt-rimmed glass, and serve.",,"Den Rand des Cocktailglases mit Limettensaft einreiben. Den Rand in grobes Salz tauchen. Tequila, blauen Curacao und Limettensaft mit Eis schütteln, in das mit Salz umhüllte Glas abseihen und servieren.",,,,Tequila,Blue Curacao,Lime juice,Salt,,,,,,,,,,,,1 1/2 oz ,1 oz ,1 oz ,Coarse ,,,,,,,,,,,,Yes,2015-08-18 14:51:53
246,Brave Bull Shooter,13068,,,,,,,,,Shot,,Alcoholic,Shot glass,Pour Tabasco into bottom of shot glass and fill with tequila.,,Tabasco auf den Boden des Schnapsglases geben und mit Tequila füllen.,,,,Tequila,Tabasco sauce,,,,,,,,,,,,,,1/2 oz ,1/2 oz ,,,,,,,,,,,,,,No,2016-09-08 15:23:45
247,Downshift,16991,,,,,,,,,Punch / Party Drink,,Alcoholic,Hurricane glass,"Start with the Sprite. Next comes the tequila. After that, add the Minute Maid Fruit Punch, then float the 151. Rocks optional.",,"Beginne mit dem Sprite. Als nächstes kommt der Tequila. Danach geben Sie die Minute Maid Fruit Punch hinzu, dann schwenken Sie die 151. Rocks optional.",,,,Fruit punch,Sprite,Tequila,151 proof rum,,,,,,,,,,,,2 part ,1 part ,2 shots ,Float Bacardi ,,,,,,,,,,,,No,2017-08-24 09:38:31
248,Margarita,11007,,,,,,,"IBA,ContemporaryClassic",,Ordinary Drink,Contemporary Classics,Alcoholic,Cocktail glass,"Rub the rim of the glass with the lime slice to make the salt stick to it. Take care to moisten only the outer rim and sprinkle the salt on it. The salt should present to the lips of the imbiber and never mix into the cocktail. Shake the other ingredients with ice, then carefully pour into the glass.",,"Reiben Sie den Rand des Glases mit der Limettenscheibe, damit das Salz daran haftet. Achten Sie darauf, dass nur der äußere Rand angefeuchtet wird und streuen Sie das Salz darauf. Das Salz sollte sich auf den Lippen des Genießers befinden und niemals in den Cocktail einmischen. Die anderen Zutaten mit Eis schütteln und vorsichtig in das Glas geben.",,,,Tequila,Triple sec,Lime juice,Salt,,,,,,,,,,,,1 1/2 oz ,1/2 oz ,1 oz ,,,,,,,,,,,,,Yes,2015-08-18 14:42:59
249,Moranguito,16196,,,,,,,,,Shot,,Alcoholic,Shot glass,"first you put rhe absinthe, then put tequila, then put the Granadine syrup.",,"Erst den Absinth, dann den Tequila, dann den Grenadinesirup.",,,,Absinthe,Tequila,Grenadine,,,,,,,,,,,,,2/5 ,2/5 ,1/5 ,,,,,,,,,,,,,No,2016-10-05 12:35:35
250,Paloma,17253,,,,,,,,,Cocktail,,Alcoholic,Collins glass,Stir together and serve over ice.,,Zusammenrühren und über Eis servieren.,,,,Grape Soda,Tequila,,,,,,,,,,,,,,3 oz,1 1/2 oz,,,,,,,,,,,,,,No,2017-12-19 17:59:53
251,Strawberry Margarita,12322,,,,,,,,,Ordinary Drink,,Alcoholic,Cocktail glass,"Rub rim of cocktail glass with lemon juice and dip rim in salt. Shake schnapps, tequila, triple sec, lemon juice, and strawberries with ice, strain into the salt-rimmed glass, and serve.",,"Cocktailglasrand mit Zitronensaft und Tauchrand in Salz wenden. Schnaps, Tequila, Triple-Sec, Zitronensaft und Erdbeeren mit Eis schütteln, in das salzige Glas sieben und servieren.",,,,Strawberry schnapps,Tequila,Triple sec,Lemon juice,Strawberries,Salt,,,,,,,,,,1/2 oz ,1 oz ,1/2 oz ,1 oz ,1 oz ,,,,,,,,,,,No,2015-08-18 14:41:51
252,Tequila Fizz,12362,,,,,,,,,Ordinary Drink,,Alcoholic,Collins glass,"Shake all ingredients (except ginger ale) with ice and strain into a collins glass over ice cubes. Fill with ginger ale, stir, and serve.",,"Alle Zutaten (außer Ginger Ale) mit Eis schütteln und in ein Collins-Glas über Eiswürfel abseihen. Mit Ginger Ale füllen, umrühren und servieren.",,,,Tequila,Lemon juice,Grenadine,Egg white,Ginger ale,,,,,,,,,,,2 oz ,1 tblsp ,3/4 oz ,1 ,,,,,,,,,,,,No,2017-09-08 17:53:57
253,Tequila Slammer,178307,,,,,,,,,Shot,,Alcoholic,Hurricane glass,Mix carefully to avoid releasing the dissolved CO2.,,,,,,Tequila,7-up,,,,,,,,,,,,,,1 shot,1 part,,,,,,,,,,,,,,No,
254,Tequila Sour,12370,,,,,,,,,Ordinary Drink,,Alcoholic,Whiskey sour glass,"Shake tequila, juice of lemon, and powdered sugar with ice and strain into a whiskey sour glass. Add the half-slice of lemon, top with the cherry, and serve.",,"Tequila, Zitronensaft und Puderzucker mit Eis schütteln und in ein Whiskey-Sourglas abseihen. Die halbe Zitronenscheibe dazugeben, mit der Kirsche garnieren und servieren.",,,,Tequila,Lemon,Powdered sugar,Lemon,Cherry,,,,,,,,,,,2 oz ,Juice of 1/2 ,1 tsp ,1/2 slice ,1 ,,,,,,,,,,,No,2017-09-07 22:43:21
255,Tequila Sunrise,13621,,,,,,,"IBA,ContemporaryClassic",,Cocktail,Contemporary Classics,Alcoholic,Highball glass,"Pour the tequila and orange juice into glass over ice. Add the grenadine, which will sink to the bottom. Stir gently to create the sunrise effect. Garnish and serve.",,"Den Tequila und den Orangensaft in ein Glas über Eis gießen. Füge die Grenadine hinzu, die auf den Boden sinken wird. Rühren Sie sanft um, um den Sonnenaufgangseffekt zu erzeugen. Garnieren und servieren.",,,,Tequila,Orange juice,Grenadine,,,,,,,,,,,,,2 measures ,,,,,,,,,,,,,,,No,2016-12-04 19:18:23
256,Tequila Surprise,14602,,,,,,,,,Shot,,Alcoholic,Shot glass,Fill shot glass with Tequila. Add drops of Tobasco sauce.,,Füllen Sie das Schnapsglas mit Tequila. Füge Tropfen Tobasco-Sauce hinzu.,,,,Tequila,Tabasco sauce,,,,,,,,,,,,,,full glass ,About 8 drops ,,,,,,,,,,,,,,No,2017-09-06 23:06:21
257,Tommy's Margarita,17216,,,,,,,"IBA,NewEra",,Ordinary Drink,New Era Drinks,Alcoholic,Old-Fashioned glass,Shake and strain into a chilled cocktail glass.,,Schütteln und in ein gekühltes Cocktailglas abseihen.,,,,Tequila,Lime Juice,Agave syrup,,,,,,,,,,,,,4.5 cl,1.5 cl,2 spoons,,,,,,,,,,,,,No,2017-09-02 18:37:54
258,Vampiro,17217,,,,,,,"IBA,NewEra",,Ordinary Drink,New Era Drinks,Alcoholic,Old-Fashioned glass,"Vampiros may be made in a tall glass or an old fashioned glass. Bartenders may first ""rim"" the glass with Kosher Salt, which is done by placing a layer of Kosher Salt on a chopping board, moistening the glass' rim with lime juice or water, and then placing the upside down glass rim onto the Kosher Salt, so that the salt sticks to the moistened rim. The second step is to fill half the glass with ice and add one or two shooter glasses full of high quality Tequila. The next stage is to add the flavouring elements. This is done by squeezing a fresh lime into the glass, adding a few grains of salt, adding citrus-flavoured soda pop, until the glass is 4/5 full, and then adding spicy Viuda de Sanchez (or orange juice, lime juice and pico de gallo). The final step is to stir the ingredients so that the flavours are properly blended.",,"Vampiros können in einem hohen Glas oder einem old fashioned Glas zubereitet werden. Der Barkeeper kann das Glas zuerst mit Koscher-Salz ""umsäumen"", indem er eine Schicht Koscher-Salz auf ein Schneidebrett legt, den Glasrand mit Limettensaft oder Wasser anfeuchtet und dann den umgedrehten Glasrand auf das Koscher-Salz legt, so dass das Salz am angefeuchteten Rand haftet. Der zweite Schritt ist, das halbe Glas mit Eis zu füllen und ein oder zwei Schaugläser mit hochwertigem Tequila hinzuzufügen. Im nächsten Schritt werden die Aromastoffe hinzugefügt. Dazu wird eine frische Limette in das Glas gepresst, einige Salzkörner hinzugefügt, zitrusartiges Natron, bis das Glas 4/5 voll ist, und dann würziges Viuda de Sanchez (oder Orangensaft, Limettensaft und pico de gallo) hinzugefügt. Der letzte Schritt ist, die Zutaten so zu rühren, dass die Aromen richtig vermischt werden.",,,,Tequila,Tomato Juice,Orange Juice,Lime Juice,Sugar Syrup,Salt,,,,,,,,,,6 cl,3 cl,3 cl,1.5 cl,1 dash,1 pinch,,,,,,,,,,No,2017-09-02 18:44:06
259,Whitecap Margarita,16158,,,,,,,,,Other/Unknown,,Alcoholic,Margarita/Coupette glass,Place all ingredients in a blender and blend until smooth. This makes one drink.,,Alle Zutaten in einen Mixer geben und mischen.,,,,Ice,Tequila,Cream of coconut,Lime juice,,,,,,,,,,,,1 cup ,2 oz ,1/4 cup ,3 tblsp fresh ,,,,,,,,,,,,No,2015-09-02 17:00:22
260,Adios Amigos Cocktail,17229,,,,,,,,,Cocktail,,Alcoholic,Martini Glass,Shake together all the ingredients and strain into a cold glass.,,Alle Zutaten vermengen und in ein kaltes Glas abseihen.,,,,Rum,Dry Vermouth,Cognac,Gin,Fresh Lime Juice,Sugar Syrup,Water,,,,,,,,,1 shot ,1/2 shot ,1/2 shot ,1/2 shot ,1/4 shot,1/4 shot,1/2 shot ,,,,,,,,,No,2017-09-07 22:31:33
261,Bahama Mama,17267,,,,,,,,,Cocktail,,Alcoholic,Highball glass,"Add 2 parts club soda or more or less to taste.

Mix it all together and pour over a bunch of ice. Drink with a straw.",,Füge 2 Teile Club-Soda oder mehr oder weniger nach Belieben hinzu. Alles zusammen mischen und über reichlich Eis gießen. Trink mit einem Strohhalm.,,,,Rum,Dark Rum,Banana liqueur,Grenadine,Pineapple Juice,Orange Juice,Sweet and Sour,,,,,,,,,3 parts,1 part,1 part,1 part,2 parts,2 parts,1 part,,,,,,,,,No,2018-01-12 21:42:19
262,Barracuda,17209,,,,,,,"IBA,NewEra",,Ordinary Drink,New Era Drinks,Alcoholic,Margarita glass,"Shake pour ingredients with ice. Strain into glass, top with Sparkling wine.",,"Schütteln Sie die Zutaten mit Eis. In ein Glas abseihen, mit Sekt übergießen.",,,,Rum,Galliano,Pineapple Juice,Lime Juice,Prosecco,,,,,,,,,,,4.5 cl,1.5 cl,6 cl, 1 dash,top up ,,,,,,,,,,,No,2017-09-02 18:12:17
263,Blue Hurricane,17268,,,,,,,,,Cocktail,,Alcoholic,Highball glass,"If each part is 1/2 oz then use about 2.5 cups of ice.

Blend it all together. 
Drink it with a big straw if you have one.

",,"Wenn jedes Teil 1,5 cl. ist, dann verwenden Sie etwa 2,5 Tassen Eis. Alles zusammenmischen. Trink es mit einem großen Strohhalm, wenn du einen hast.",,,,Rum,Dark Rum,Passoa,Blue Curacao,Sweet and Sour,Ice,,,,,,,,,,4 parts,2 parts,1 part,1 part,6 parts,cubes,,,,,,,,,,No,2018-01-12 22:23:42
264,Espresso Rumtini,178309,,,,,,,"DinnerParty,StrongFlavor",,Cocktail,,Alcoholic,Cocktail glass,Mix together in a cocktail glass. Garnish with some choclate powder and coffee beans,,,,,,Rum,Vanilla syrup,Espresso,Coffee,,,,,,,,,,,,1 shot,1/2 shot,1 shot,1 shot,,,,,,,,,,,,Yes,
265,Hemingway Special,17201,,,,,,,"IBA,ContemporaryClassic",,Ordinary Drink,Contemporary Classics,Alcoholic,Cocktail glass,Pour all ingredients into a shaker with ice. Shake.,,Alle Zutaten in einen Shaker mit Eis geben. Schütteln.,,,,Rum,Grapefruit Juice,Maraschino Liqueur,Lime Juice,,,,,,,,,,,,12 parts,8 parts,3 parts,3 parts,,,,,,,,,,,,No,2017-09-02 17:31:28
266,Jamaican Coffee,15825,,,,,,,,,Coffee / Tea,,Alcoholic,Champagne flute,"Stir the rum, coffee and water together. Top with the whipped cream. Sprinkle with a pinch of well ground coffee and drink with a straw.",,"Rum, Kaffee und Wasser miteinander verrühren. Mit der geschlagenen Sahne bedecken. Mit einer Prise gut gemahlenem Kaffee bestreuen und mit einem Strohhalm trinken.",,,,Rum,Coffee,Water,Whipped cream,,,,,,,,,,,,1/6 glass ,1/6 glass strong black ,1/2 glass cold ,,,,,,,,,,,,,No,2015-09-03 03:27:37
267,Rum Cooler,12071,,,,,,,,,Ordinary Drink,,Alcoholic,Collins glass,Pour the rum and soda into a collins glass almost filled with ice cubes. Stir well and garnish with the lemon wedge.,,"Den Rum und das Soda in ein Collins-Glas gießen, das fast mit Eiswürfeln gefüllt ist. Gut umrühren und mit dem Zitronenkeil garnieren.",,,,Rum,Lemon-lime soda,Lemon,,,,,,,,,,,,,2 oz light or dark ,4 oz ,1 ,,,,,,,,,,,,,No,2017-09-08 17:37:54
